{
  "$schema": "http://json-schema.org/draft-07/schema#",
  "$id": "https://stirstudios.dev/contracts/v1/webform.schema.json",
  "title": "Stir Layout Builder Webform payload",
  "type": "object",
  "additionalProperties": false,
  "required": [
    "schemaVersion",
    "webformId",
    "webformTitle",
    "fields",
    "actions",
    "webformConfirmation",
    "webformConfirmationType",
    "webformRedirect",
    "webformSubmissions"
  ],
  "properties": {
    "schemaVersion": { "const": 1 },
    "webformId": { "type": "string", "minLength": 1 },
    "webformTitle": { "type": "string" },
    "fields": {
      "type": "object",
      "additionalProperties": { "$ref": "#/definitions/field" }
    },
    "actions": {
      "type": "array",
      "items": { "$ref": "#/definitions/action" }
    },
    "webformConfirmation": { "type": "string" },
    "webformConfirmationType": { "type": "string", "minLength": 1 },
    "webformRedirect": { "type": ["string", "null"] },
    "webformSubmissions": { "type": ["string", "null"] }
  },
  "definitions": {
    "field": {
      "type": "object",
      "required": ["#type", "#name"],
      "properties": {
        "#type": { "type": "string", "minLength": 1 },
        "#name": { "type": "string", "minLength": 1 },
        "#title": { "type": ["string", "null"] },
        "#required": { "type": "boolean" },
        "#disabled": { "type": "boolean" },
        "#readonly": { "type": "boolean" },
        "#floatingLabel": { "type": "boolean" },
        "#modal": { "type": "boolean" },
        "#relocated": { "type": "boolean" },
        "#multiple": {
          "oneOf": [
            { "type": "boolean" },
            { "type": "integer", "minimum": 1 }
          ]
        },
        "#cardinality": { "type": "integer", "minimum": 1 },
        "#defaultValue": {},
        "#inputType": { "type": "string" },
        "#requiredError": { "type": "string" },
        "#optionProperties": { "type": "object" },
        "#perGuest": { "type": "boolean" },
        "#isTaxable": { "type": "boolean" },
        "#serviceFeeApplicable": { "type": "boolean" },
        "#maxSelected": { "type": "integer", "minimum": 0 },
        "#minSelected": { "type": "integer", "minimum": 0 },
        "#groupMaxSelected": { "type": "integer", "minimum": 0 },
        "#tabGroup": { "type": "string" },
        "#timezone": { "type": "string", "minLength": 1 },
        "#dateMin": {
          "description": "A date or datetime element's earliest date, resolved from #date_date_min or #date_min in #timezone.",
          "type": "string",
          "pattern": "^\\d{4}-\\d{2}-\\d{2}$"
        },
        "#dateMax": {
          "description": "A date or datetime element's latest date, resolved from #date_date_max or #date_max in #timezone.",
          "type": "string",
          "pattern": "^\\d{4}-\\d{2}-\\d{2}$"
        },
        "#optionKeys": { "$ref": "#/definitions/keyList" },
        "#questionKeys": { "$ref": "#/definitions/keyList" },
        "#answerKeys": { "$ref": "#/definitions/keyList" },
        "#conditions": {
          "description": "The element's #states with every element name as a value, since Custom Elements camel-cases the selector keys of #states. Container visibility is included.",
          "type": "array",
          "items": { "$ref": "#/definitions/conditionGroup" }
        },
        "#composite": {
          "description": "Composite parts as Webform initializes them. Keys are camel-cased in transport; #name is the key Drupal stores.",
          "type": "object",
          "additionalProperties": { "$ref": "#/definitions/compositePart" }
        },
        "children": {
          "type": "object",
          "additionalProperties": { "$ref": "#/definitions/field" }
        }
      },
      "additionalProperties": true
    },
    "keyList": {
      "description": "The Drupal keys of a camel-cased map, in order.",
      "type": "array",
      "items": { "type": "string" }
    },
    "compositePart": {
      "type": "object",
      "required": ["#name"],
      "properties": {
        "#name": { "type": "string", "minLength": 1 },
        "#type": { "type": "string", "minLength": 1 },
        "#title": { "type": ["string", "null"] },
        "#required": { "type": "boolean" },
        "#optionKeys": { "$ref": "#/definitions/keyList" }
      },
      "additionalProperties": true
    },
    "conditionGroup": {
      "type": "object",
      "required": ["state", "logic", "rules"],
      "properties": {
        "state": { "type": "string", "minLength": 1 },
        "logic": { "enum": ["and", "or", "xor"] },
        "rules": { "type": "array", "items": { "$ref": "#/definitions/conditionRule" } }
      },
      "additionalProperties": false
    },
    "conditionRule": {
      "oneOf": [
        {
          "type": "object",
          "required": ["logic", "rules"],
          "properties": {
            "logic": { "enum": ["and", "or", "xor"] },
            "rules": { "type": "array", "items": { "$ref": "#/definitions/conditionRule" } }
          },
          "additionalProperties": false
        },
        {
          "type": "object",
          "required": ["name", "selector", "triggers"],
          "properties": {
            "name": {
              "description": "Submission path of the element the selector targets, dotted for nested values (address.city, extras.early_bird); null when the selector names no input.",
              "type": ["string", "null"]
            },
            "selector": { "type": "string" },
            "triggers": {
              "description": "Webform triggers, any of which passes the rule.",
              "type": "array",
              "items": {
                "type": "object",
                "required": ["trigger", "value"],
                "properties": {
                  "trigger": { "type": "string", "minLength": 1 },
                  "value": {}
                },
                "additionalProperties": false
              }
            }
          },
          "additionalProperties": false
        }
      ]
    },
    "action": {
      "type": "object",
      "required": ["#type"],
      "properties": {
        "#type": { "type": "string", "minLength": 1 },
        "#title": { "type": "string" },
        "#submitLabel": { "type": "string" }
      },
      "additionalProperties": true
    }
  }
}
